{
  "type": "object",
  "properties": {
    "schema_version": {
      "const": 1
    },
    "id": {
      "type": "string",
      "pattern": "^[A-Za-z0-9][A-Za-z0-9_.-]{0,127}$"
    },
    "recorded_at": {
      "type": "string",
      "format": "date-time"
    },
    "occurred_at": {
      "anyOf": [
        {
          "type": "string",
          "format": "date-time"
        },
        {
          "type": "null"
        }
      ]
    },
    "status": {
      "enum": [
        "prospective",
        "retrospective"
      ]
    },
    "branch_ids": {
      "type": "array",
      "items": {
        "type": "string",
        "pattern": "^[A-Za-z0-9][A-Za-z0-9_.-]{0,127}$"
      }
    },
    "hypothesis_ids": {
      "type": "array",
      "items": {
        "type": "string",
        "pattern": "^[A-Za-z0-9][A-Za-z0-9_.-]{0,127}$"
      }
    },
    "run_ids": {
      "type": "array",
      "items": {
        "type": "string",
        "pattern": "^[A-Za-z0-9][A-Za-z0-9_.-]{0,127}$"
      }
    },
    "analysis_ids": {
      "type": "array",
      "items": {
        "type": "string",
        "pattern": "^[A-Za-z0-9][A-Za-z0-9_.-]{0,127}$"
      }
    },
    "decision_ids": {
      "type": "array",
      "items": {
        "type": "string",
        "pattern": "^[A-Za-z0-9][A-Za-z0-9_.-]{0,127}$"
      }
    },
    "supersedes": {
      "type": "array",
      "items": {
        "type": "string",
        "pattern": "^[A-Za-z0-9][A-Za-z0-9_.-]{0,127}$"
      }
    },
    "author": {
      "type": "string"
    },
    "model": {
      "anyOf": [
        {
          "type": "string"
        },
        {
          "type": "null"
        }
      ]
    }
  },
  "required": [
    "schema_version",
    "id",
    "recorded_at",
    "occurred_at",
    "status",
    "branch_ids",
    "hypothesis_ids",
    "run_ids",
    "analysis_ids",
    "decision_ids",
    "supersedes",
    "author",
    "model"
  ],
  "additionalProperties": false,
  "$schema": "https://json-schema.org/draft/2020-12/schema",
  "$id": "https://researchflow.local/v1/journal_header.json"
}
